{
  "captured_at": "2026-05-26T01:25:16.751821+00:00",
  "gpu": {
    "available": false,
    "have_nvidia_smi": true,
    "have_nvcc": true,
    "gpus": [],
    "note": "GPU probe skipped: manifest does not declare requires_gpu."
  },
  "container": {
    "requires_docker": false,
    "image_digest_observed": null,
    "note": "Container digest/labels not captured by MVP provenance. Add via skill-side instrumentation when the wrapper spawns docker."
  },
  "network": {
    "declared_endpoints": [],
    "observed_endpoints": null,
    "note": "Endpoint observation not implemented; tracked as planned work."
  },
  "side_effects": {
    "before": [],
    "after": [],
    "findings": []
  }
}